<?xml version="1.0" encoding="UTF-8"?>
<xs:schema xmlns:xs="http://www.w3.org/2001/XMLSchema">

	<xs:simpleType name="dbtimetype">
		<xs:restriction base="xs:string">
			<xs:pattern
				value="((000[1-9])|(00[1-9][0-9])|(0[1-9][0-9]{2})|([1-9][0-9]{3}))-((0[1-9])|(1[012]))-((0[1-9])|([12][0-9])|(3[01])) (([01][0-9])|(2[0-3]))(:[0-5][0-9])(:[0-5][0-9])((\.[0-9]+)|)" />
		</xs:restriction>
	</xs:simpleType>

	<xs:simpleType name="clientactivestate">
		<xs:restriction base="xs:string">
			<xs:enumeration value="ACTIVE" />
			<xs:enumeration value="DELETED" />
		</xs:restriction>
	</xs:simpleType>

	<xs:simpleType name="clienttype">
		<xs:restriction base="xs:string">
			<xs:enumeration value="REGULAR" />
			<xs:enumeration value="GOLD" />
			<xs:enumeration value="PLATINUM" />
		</xs:restriction>
	</xs:simpleType>

	<xs:simpleType name="deposittype">
		<xs:restriction base="xs:string">
			<xs:enumeration value="SHORT" />
			<xs:enumeration value="LONG" />
		</xs:restriction>
	</xs:simpleType>

	<xs:complexType name="account">
		<xs:attribute name="account_id" type="xs:integer" />
		<xs:attribute name="client_id" type="xs:integer" />
		<xs:attribute name="balance" type="xs:double" />
		<xs:attribute name="credit_limit" type="xs:double" />
		<xs:attribute name="comment" type="xs:string" />
	</xs:complexType>

	<xs:complexType name="activity">
		<xs:attribute name="activity_id" type="xs:integer" />
		<xs:attribute name="activity_date" type="dbtimetype" />
		<xs:attribute name="client_id" type="xs:integer" />
		<xs:attribute name="amount" type="xs:double" />
		<xs:attribute name="commision" type="xs:double" />
		<xs:attribute name="description" type="xs:string" />
	</xs:complexType>

	<xs:complexType name="client">
		<xs:attribute name="client_id" type="xs:integer" />
		<xs:attribute name="address" type="xs:string" />
		<xs:attribute name="client_name" type="xs:string" />
		<xs:attribute name="email" type="xs:string" />
		<xs:attribute name="password" type="xs:string" />
		<xs:attribute name="comment" type="xs:string" />
		<xs:attribute name="phone" type="xs:string" />
		<xs:attribute name="clientactivestate" type="clientactivestate" />
		<xs:attribute name="type" type="clienttype" />
	</xs:complexType>

	<xs:complexType name="deposit">
		<xs:attribute name="deposit_id" type="xs:integer" />
		<xs:attribute name="client_id" type="xs:integer" />
		<xs:attribute name="opening_date" type="dbtimetype" />
		<xs:attribute name="closing_date" type="dbtimetype" />
		<xs:attribute name="balance" type="xs:double" />
		<xs:attribute name="type" type="deposittype" />
	</xs:complexType>

	<xs:complexType name="property">
		<xs:attribute name="prop_key" type="xs:string" />
		<xs:attribute name="prop_value" type="xs:string" />
	</xs:complexType>


	<xs:element name="dataset">
		<xs:complexType>
			<xs:choice maxOccurs="unbounded">
				<xs:element name="clients" type="client" maxOccurs="unbounded"  />
				<xs:element name="accounts" type="account" maxOccurs="unbounded" />
				<xs:element name="activities" type="activity" maxOccurs="unbounded" />
				<xs:element name="deposites" type="deposit" maxOccurs="unbounded" />
				<xs:element name="properties" type="property" maxOccurs="unbounded" />
			</xs:choice>
		</xs:complexType>
	</xs:element>


</xs:schema>